Model,Water Body Type,Watershed Size,Watershed Type,Simulation Type,Parameters,Model Time Step ,Time Step,Computation requirements,Model Complexity,Simulation Objectives,Data Requirements,Model Availability,Model Limitations,Notes
AED - GLM,Water body,,,,,,,Computational expensive, ,,,Open source,"
- The coupled model was, however, unable to capture spatial gradients in nutrient limitation (Wang et al., 2021).
- To facilitate the use of the model in teaching environments and for users with limited technical support, it may be operated without any third-party software, as the input files consist of “namelist” (nml) text files for configuration and csv files for meteorological and flow time series data (Hipsey et al., 2019)
",
AGNPS,Watershed,Medium,Agricultural,Event-based model,"Q, TP, TN ",,Daily,Computational expensive,Complex,,"DEM, LULC, Soil",Open source,"
- The inability to predict peak flow accurately, even in an agricultural watershed (Najim et al., 2005)
- Inability to assess nutrient transformation and in-stream processes; thus, the model is capable of simulating only single events (Adu and Kumarasamy, 2018).
- One limitation of distributed models such as AGNPS is that preparation of input data files and interpretation of simulation results may become overwhelming and
time-consuming with increase in cell numbers (Tim and Jolly, 1994; Tim et al., 1995; Tim, 1996; Liao and Tim, 1997; Mankin et al., 2002).
- AGNPS model does not have the capability to predict runoff generating areas (Panjabi, 2019).",
AGNPS-VSA,Watershed,Medium,Agricultural,Event-based model,"Q, TP, TN ",,Daily,Computational expensive,Complex,,"DEM, LULC, Soil",Open source,,Variable Source Area (VSA) integration means the models have been reconceptualized to inlcude saturation excess mechanism in generating runoff. It improves the representation of runoff generation by considering areas within the watershed that contribute more significantly to runoff due to their hydrological characteristics
AnnAGNPS,Watershed,Medium,Agricultural,Continuous model,"Q, TP, TN, TSS",Daily,Daily,"Computational expensive, user-friendly",Complex,"Holistic Simulation, BMP locations","DEM, LULC, Soil, Precipitation, Temperature",Open source ,"Does not simulate baseflow, poor sediment simulation, poor groundwater simulation, manual calibration,  limited developer and community support, Point source loads are limited to constant loading rates for the entire simulation period, can not be coupled with optimization algorithm, does not simulate large watersheds, does not simulate urban watersheds, sensitive to parameter calibration",(https://www.ars.usda.gov/southeast-area/oxford-ms/national-sedimentation-laboratory/watershed-physical-processes-research/docs/annagnps-pollutant-loading-model/)
DLEM,Watershed,"Medium, Large","Agricultural, Urban",Continuous model,"Q, TP, TN, TSS",Daily,Daily,"Computational expensive, user-friendly",Complex,Holistic Simulation,"DEM, LULC, Soil, Precipitation, Temperature",Open source,"poor sediment simulation, can not be coupled with optimization algorithm, manual calibration,  poor groundwater simulation, limited community support. Poor Simulation of Extreme Events, poor simulation of small watersheds ",
ELEMeNT-N,Watershed,Medium,"Agricultural, Urban",Continuous model,TN,,Daily,Computational expensive,Medium,"Evaluate legacy Nitrogen, predict nitrogen transport and transformation within a watershed","LULC, N surplus",NA,"
ELEMeNT-N is limited in its ability to address long-term legacy N dynamics as it ignores temporal changes in soil organic N (SON) mineralization rates (Zhou et al., 2023).
Limited by the model structure and data availability, N aged >10 years consisted of two components: N inputs from more than 10 years ago and the natural background N pool (Zhou et al., 2023), the assumption of simplified hydrological and biogeochemical processes, manual calibration",
QUAL2E,Water Body,,,,,,,Computational expensive,,,,US EPA,"
-The model provides 1-D simulation, while fow is supposed to be in a steady state (Costa et al. 2019)
-It is not well-suited to simulate branches of the river system (Costa et al. 2019)
-It is not well-suited to simulate denitrifcation processes, macrophytes growth, and suspended sediment movement (Ejigu 2021).
-Some of the QUAL models are moderately sensitive to nitrifcation rate, point source fow, CBOD and highly sensitive to water depth (Macholo 2016).
-No uncertainty component is incorporated (Costa et al. 2019).
-  Zooplankton and bacteria compartment are not considered (Srinivas and Singh, 2018).",
HYDROTEL,Watershed,,,Continuous model,Q,Daily,Daily,"Computational Expensive
",Complex,Holistic Simulation,"Precipitation, Temperature, ",Not open source,"Does not simulate Water quality
",
"ITEEM: (1) SWAT (2) wastewater treatment (WWT) models; (3) corn biorefinery (CB) models developed using SuperPro Designer (Intelligen, Inc.) to investigate the potential for P recovery and assess energy consumption; (4) a drinking water treatment model
(DWT); (5) an empirical economic model.",Watershed,,,,,,,"Computational Expensive
",,,,SWAT is Open source,"
- ITEEM, a surrogate-based model, adopts a large number of
parameters from several process models (SWAT, GPS-X,
SuperPro) (Li et al., 2021). These models were well-calibrated before they were converted into surrogates (Li et al., 2021). Indeed, dealing with uncertainty transform in surrogating modeling and uncertainty analysis of an integrated model involving many uncertain parameters from multiple process models is challenging and presents a timely important research problem (Li et al., 2021).",
LSPC,Watershed,,,Continuous model,"Q, TP, TN, TSS",Hourly,Sub-daily,Computational Expensive,Medium,"Holistic Simulation, TMDL development,  assess the effects of land use change","DEM, LULC, Soil, Precipitation, Temperature, evapotranspiration",Open source,"does not allow multiple subbasins to connect to a single reach, poor interactive process between surface and subsurface water, does not simulate BMPs, poor sediment simulation, can not be coupled with optimization algorithm, manual calibration, poor groundwater simulation, limited community support",
MapShed,Watershed,"Medium, Large",Agricultural,Continuous model,"Q, TP, TN, TSS",Daily,Daily,Computational Expensive,Medium,Holistic Simulation,"DEM, LULC, Soil, Precipitation, Temperature",Open source,"One limitation with the model is that it takes all the crops as one, missing channel/river routing, manual calibration,  poor sediment simulation, poor groundwater simulation, can not be coupled with optimization algorithm, limited applications in urban watersheds, the simulation is still based on monthly step",
AVGWLF,Watershed,"Medium, Large",Agricultural,Continuous model,"Q, TP, TN, TSS",Daily,Daily,Medium Complex,Medium,"Holistic Simulation, TMDL development","DEM, LULC, Soil, Precipitation, Temperature",Open source,"Monthly nutrient load outputs, poor groundwater simulation, manual calibration, can not be coupled with optimization algorithm, limited applications in urban watersheds, ",
WASP8,Water body,,,,,,,Computational Expensive,,,,Open source,"
-Model calibration and its application to simulate some water quality parameters requires extensive amount of data and a signifcant amount of time (Kayode and Muthukrishna 2018; Ejigu 2021). -It is not wellsuited to simulate sinkable/foatable materials, near-feld efects or mixing zones (Costa et al. 2021). -It is not well-suited to simulate microalgae and periphyton dynamics (Kayode and Muthukrishna 2018). -It does not incorporate some variable processes (i.e. non-aqueous phase liquids, metals speciation, segment drying, and mixing zone processes) (Ejigu 2021). -It is not able to simulate successfully the variation of suspended solids loading in the river (Ejigu 2021). -Linking with multi-dimensional hydrodynamic models requires substantial site-specific linking eforts (Kannel et al. 2011).-Does not offer flexibility to consider different groups of CBOD; environmental parameters and benthic algae not considered (Srinivas and Singh, 2018).-WASP does not deal with non-point source pollution and there is no provision for developing TMDLs and to perform uncertainty analysis (Rai et al., 2024). -The model cannot accurately simulate inflows of fine silt and clay sediments from the tributaries and cannot replicate particle settling and resuspension processes within the lake (Di Vittorio et al., 2023).
",
Mike Basin,Watershed,"Medium, Large","Agricultural, Urban",Continuous model,"Q, TP, TN",Daily,Daily,Computational Expensive,Complex,Holistic Simulation,"DEM, LULC, Precipitation, Temperature",Not open source,"It lacks optimization procedures for reservoir operation, poor sediment simulation . not well documented, manually calibration, the resolution of Mike Load Calculator is the subcatchment, which means the available N and P yields were averaged for subbasins before being used in the quality modeling",Former name of MIKE HYDRO
MIKE21,Water body,,,,,,,Computational Expensive,,,,Not open source,"
- The mesh size setting of the MIKE21 model could also affect the accuracy of model simulation (Lai et al., 2022).
- Costs to purchase a license and pay for annual support fees can be significant (Northwest Hydraulic Consultants (NHC), Yolo County and cbec eco engineering, 2012).
- The model lacks the capability to model the complex
flow patterns within the hydraulic jump (Toombes and Chanson, 2011). 
- If the topography data is provided in small tiles, these tiles need to be combined to form a single topography data set in order to be used (DHI, 2018).",
GWLF,Watershed,,,Continuous model,"Q, TP,TN, TSS",Monthly,Monthly,Medium Complex,Medium,"Holistic Simulation, TMDL development","DEM, LULC, Precipitation, Temperature",Open source,"poor groundwater simulation, manual calibration, can not be coupled with optimization algorithm, limited applications in urban watersheds, lacks the conception of subbasin, ignores spatial variability in sub-surface modeling, not user friendly","The Generalized Watershed Loading Function (GWLF) and ArcView Generalized Watershed Loading Function (AVGWLF) are closely related models, with AVGWLF being a GIS-enhanced version of the original GWLF model."
RGWLF,Watershed,"Medium, Large",Agricultural,Continuous model,"Q, TP, TN, TSS",Daily,Daily,"Medium Complex
Model (Easier to use than SWAT, HSPF (Yuan et al., 2020))",Medium,"Holistic Simulation, TMDL development","DEM, LULC, Precipitation, Temperature",Open source,"poor groundwater simulation,  can not be coupled with optimization algorithm, limited applications in urban watersheds","In Conclusion:
GWLF is the simplest version, with no GIS integration, making it labor-intensive and harder to use for spatially explicit analysis.
AVGWLF improves upon GWLF by integrating with ArcView GIS, offering better spatial analysis and visualization tools but still reliant on older technology.
RGWLF is the most advanced, built for modern GIS platforms (ArcGIS, QGIS), and offers significant improvements in ease of use, simulation capabilities, and support, making it the most flexible and powerful version of the model for contemporary watershed management."
SSHBS,Water body,,,,,,,Computational expensive,,,,NA,"There are other factors that can influence the actual rate that is not explicitly modeled in SSHBS, available carbon sources, redox anaerobic pH condition, and level of microbial activity",
APEX,Watershed,Small,"Agricultural, Urban",Continuous model,"Q, TP, TN, TSS",Daily,Daily,Computational expensive,Complex,"Holistic Simulation, Assess the effects of BMPs on crop growth and water quality","LULC, Soil, Precipitation, Temperature",Open source,"field scale model, poor groundwater simulation, does not simulate large watersheds, manual calibration, can not be coupled with optimization algorithm, sensitive to specific input parameters",The APEX model is based on the EPIC model. It includes EPIC functions and was developed to extend the capability of the EPIC model (Sharpley and Williams 1990).
"SWAPP (""Comprehensive Environmental Optimization Tool SWAT–APEX Interface"" model)",Watershed,"Medium, Large","Agricultural, Urban",Continuous model,"Q, TP, TN, TSS",Daily,Daily,Computational expensive,Complex,"Holistic Simulation, BMP Evaluations","DEM, LULC, Soil, Precipitation, Temperature",Open source,"
- The SWAPP model does not consider the effectivity and efficiency of BMPs (Liu et al., 2021).
- In study areas that may be lacking in either GW- or SW-related inputs or observational data, the ability to produce a faithful model may be limited (Chunn et al., 2019).
- This coupled model encounters a limitation shared with all models: the trade-off between scientific accuracy and computational burden while keeping the study goal in mind (Chunn et al., 2019).","SWAPP model combines SWAT and APEX models. SWAPP converts SWAT files to–and–from APEX format and simultaneously simulates SWAT and APEX. This arrangement of the SWAT and APEX models allows for simulating scenarios, such as filter strips, at the field–level using APEX, which is not feasible in SWAT."
"SWAT - MODFLOW
",Watershed,,,Continuous model,"Q, TP, TN, TSS",Daily,Daily,Computational expensive,Complex,"Holistic Simulation, TMDL development, Watershed management, BMP locations","DEM, LULC, Soil, Precipitation, Temperature, Wind, Solar radiation, Relative humidity, hydraulic conductivity, specific storage, specific yield, and porosity",Open source,"
-SWAT-MODFLOW requires more effort and data to be set up and calibrated, and longer time to run (around 6 hours for a 19-year simulation in SWAT-MODFLOW by a desktop with an Intel® Core™ Processor i7-6700 CPU and 16 GB installed RAM versus 6 minutes for a SWAT simulation) (Liu et al., 2019).","a new coupled model, the so–called SWAT–MODFLOW, has fully coupled SWAT with the groundwater flow model “MODFLOW” to accurately simulate and improve the groundwater component."
"SWAT 

",Watershed,"Medium, Large","Agricultural, Urban",Continuous model,"Q, TP, TN, TSS",Daily,Daily,Computational Expensive,Complex,"Holistic Simulation, TMDL development, Watershed management, BMP locations","DEM, LULC, Soil, Precipitation, Temperature, Wind, Solar radiation, Relative humidity",Open source,"poor groundwater simulation, poor sediment simulation, sensitive to parameter calibration",
SWAT-VSA ,Watershed,,,Continuous model,"Q, TP, TN, TSS",Daily,Daily,Computational Expensive,Complex,Holistic Simulation,"DEM, LULC, Soil, Precipitation, Temperature",Open source,"
-  For SWAT-VSA high flows were associated with wider 95% credible intervals of the marginal effects relative to low lows, indicating greater model uncertainty compared with SWAT and CBP-Model (Wagena et al., 2019).
",Variable Source Area (VSA) integration means the models have been reconceptualized to inlcude saturation excess mechanism in generating runoff. 
HSPF,Watershed,"Medium, Large","Agricultural, Urban",Continuous model,"Q, TP, TN ",Hourly,"Sub-daily, Daily",Computational Expensive,Complex,"Holistic Simulation, Watershed management, TMDL development, BMP locations","DEM, LULC, Soil, Precipitation, Temperature",Open source,"Does not Simulate physical characteristics of BMPs,  manual calibration,  not user friendly, sensitive to specific input parameters",FORTRAN
"SWAT-MODFLOW-RT3D
",Watershed,,,,,,,Computational expensive,,,,Open source,"
does not account for NO3 transport in the vadose zone, Numerous parameters related to the water quality, runoff and water level were required when building the coupled SWAT-MODFLOW-RT3D model, which will limit the application of this coupled model in area that lacking those data (Zhang et al., 2024).",
SWAT+,Watershed,,,,,,,Computational expensive,,,,Open source,"
- The values in SWAT(3S) are in better agreement with the
model results of previous studies in the catchment (Kiesel et al., 2010; Pfannerstill et al., 2014) than the values estimated by SWAT+.
- Few studies have investigated the use of SWAT+ for representing hydrological consequences of climate change (Pulighe et al., 2021).
- As with the original SWAT modeling code, SWAT+ simulates groundwater flow and aquifer-stream water exchange within the following constraints: groundwater head is controlled only by recharge and groundwater discharge to streams; groundwater flow to streams is based on the presence of a groundwater divide; groundwater flow
to streams is based on steady flow conditions; seepage from streams to the aquifer is not simulated; the groundwater in each aquifer is treated independently from adjacent aquifers; and each aquifer unit has homogeneous aquifer properties (Bailey et al., 2022). To overcome these limitations, Bailey et al. (2020a) introduced the gwflow module for SWAT+, which simulates groundwater storage, groundwater head, and resulting groundwater flow for unconfined groundwater systems in a physicallybased spatially-distributed manner (Bailey et al., 2022).","• QSWAT+, a QGIS interface for setting up your watershed (SWAT, n.d.)
• SWAT+ Editor, a user interface for modifying SWAT+ inputs and running the model (SWAT, n.d.)"
SWMM,Watershed,,,"Event-based model, Continuous model","Q, TP, TN, TSS",Hourly,Sub-daily,Computation Expensive,Complex,"design drainage system component, developing TMDL, estimate BMP and low impact development stormwater controls to meet sustainable goals, evaluate combined and sanitary sewer overflows, estimate the effect of land-use change on urban hydrology.","DEM, LULC, Soil, Precipitation, Temperature","Open source
(https://www.epa.gov/water-research/storm-water-management-model-swmm)","Fundamental problem in coupling the SWMM and GA with continuous simulation. Urban land uses, it does not simulate small outlets (manhole or inlets) loss directly, but rather can be aggregated, limited to urban watersheds",
SWMM - Linearized model based on SWMM.,Watershed,,,,,,,No need for a high-end computer.,,,,Open source,"despite the advantages of linear models in providing a global optimum in a short runtime, their solutions are not necessarily better than other methods",
PCSWMM,Watershed,,,"Event-based model, Continuous model","Q, TP, TN, TSS",Hourly,Sub-daily,Computational expensive,Complex,"Holistic Simulation, Designing and Sizing Drainage Systems, Floodplain Mapping, BMP Evaluations","DEM, LULC, Soil, Precipitation, Temperature",Not open source,"Unless the mathematical concepts representing the surface and soil layer are made more representative of reality as well as made to be dynamic, the LID component for modeling bioretention cells in PCSWMM could not be sufficiently verified, SWMM is limited to urban watersheds",
SWMM-ICM,Watershed,,,,,,,Computational expensive,,,,Not open source,There is a unique identifier requirement in SWMM that does not permit having the same ID for a Subcatchment and a Node with ICM,
TETIS - N,Watershed,,,Continuous model,"Q, TN",Daily,Daily,Computational Expensive,,"Holistic Simulation, BMP Evaluations","DEM, LULC, Soil, Precipitation, Temperature",Not open source,"Does not simulate P
",
WAM,Watershed,"Medium, Large","Agricultural, Urban",Continuous model,"Q, TP, TN, TSS",Daily,Daily,Computational Expensive,Complex,"Holistic Simulation, BMP locations","DEM, LULC, Soil, Precipitation, Temperature",Open source,"manual calibration, poor groundwater simulation, poor sediment simulation, can not be coupled with optimization algorithm, Limited to Florida terrain",
DMSTA2,"Wetlands, specific to South Florida",,,,,,,STA (Stormwater Treatment Area) Design Tool,,,,Open source,"There are known limitations of DMSTA2 including concerns about its predictive ability at very low TP outflow targets, focus on long-term steady state simulations, and inability to predict phosphorus gradient within treatment cells",
Gridded Surface/Subsurface Hydrologic Analysis (GSSHA) model ,Small Watershed,,,Continuous model,"Q. TP, TN, TSS",Hourly,Sub-daily,"Computational expensive (more intense than SWMM) (Moore et al., 2017)",Complex,"Holistic Simulation, TMDL development, BMP Evaluations, Extreme events evaluation","DEM, LULC, Soil, Precipitation, Temperature","Although the GSSHA model executable can be downloaded for free (GSSHA 2019), a WMS software license must be purchased to use GSSHA in WMS.","Several of required parameters and the unavailability of most of these parameters, a solution grid with a cell size of bigger than 200 m in GSSHA model can lead to signifcant errors in the results, As the time step is further increased, the discharge at the outlet will oscillate and the model may crash, GSSHA does not allow for irregular pipe cross sections, and theoption for rectangular cross sections was not functional, GSSHA storm sewer pipes and stream channels are not fullylinked; flow can only travel from the pipes into the channels, GSSHA does not support autocalibration of the storm sewerparameters with its implementation of the PEST parameter estimation and uncertainty analysis software package",GSSHA is better for event-based simulations than for long-term simulations
EFDC,Water body,,,,,,,Computational expensive,,,,Not open source,,
Water Erosion Prediction Project-Water Quality (WEPP-WQ) model,Watershed,Small,Agricultural,Continuous model,"Q, TP, TN, TSS",Daily,Daily,Computational expensive,Complex,"Holistic Simulation, BMP Evaluations","DEM, LULC, Soil, Precipitation, Temperature",Open source,poor nitrate simulation,WEPP-WQ could potentially be used to simulate detailed VFS and BMP processes and impacts.
CE-QUAL-W2,Water body,,,,,,,Computational expensive,,,,"Open source
(www.ce.pdx.edu/w2)","The model does not simulate multiple species for phytoplankton, The model is not capable of simulating the possible localized water quality change resulted from development activities in the watershed, The governing equations are averaged layer and laterally; lateral variations in temperature, velocities, and water quality constituents are not accounted for; it is a complex model and its operation is timeconsuming; the complexity of the model limits the data required for its operation; vertical momentum is not included, which might not give an accurate outcome in the case of significant acceleration, The laterally averaged equations of the hydrodynamics and transport equations make the variations in water temperatures, velocities, and water constituent concentrations insignifcant, that may be unsuitable for large waterbodies, The hydrostatic assumption is not satisfed in all fluid motion scenarios, The laterally averaged of complete homogeneity along the lateral direction is not met in broad rivers, The equations describing the algal processes are oversimplifed, compromising the model accuracy to simulates the algal growth, The model doest not incorporates Zooplankton, SOD and metals",
SimplyP,Watershed,,,Continuous model,"Q, TP, TSS",Daily,Daily,No need for a high-end computer.,Simple,Holistic Simulation,"LULC, Soil, Precipitation, Temperature, PET",Open source,"manual calibration, The Python version is slow, and the model has recently been recoded into C plus plus using the MOBIUS model building framework, Incidental P losses, potentially large P fluxes washed into watercourses when rainfall events coincide with fresh fertilizer and manure applications, are not yet included",
Delft3D-Flow,Water body (Reservoir),,,,,,,Computational expensive,,,,Open source (https://oss.deltares.nl/web/delft3d/get-started),"The model shows small sensitivity to the river discharge values and relatively large sensitivity to bed roughness (Koning and Janssen, 2016). -Delft3D-Flow model may require higher grid cell resolution to result in comparably same depth-averaged velocities throughout the study area (Parsapour-Moghaddam et al., 2018).",
CBP-WSM (Chesapeake Bay Program Watershed Model),Watershed,,,Continuous model,"Q, TP, TN, TSS",Daily,Daily,Computational expensive,Complex,"Holistic Simulation, TMDL development, BMP Evaluations ","LULC, Soil, Precipitation, Temperature",Not open source,"Spatial limitations of the WSM preclude edge of field scale representation of phosphorus (P) losses, Loads modeled by scenarios with MP effects are always lower than the alternative scenario because the CBPWSM assigns a load reduction credit to each MP, CBPWSM does not model lag times, limited to the Chesapeake Bay Watershed",
CAST,Watershed,,,Continuous model,"Q, TP, TN, TSS",Daily,Daily,Computational expensive,Complex,"Holistic Simulation, TMDL development, BMP Evaluations ","LULC, Soil, Precipitation, Temperature","The Chesapeake Bay Program's Phase 6 Watershed Model, CAST, and its documentation can be accessed, free of charge, in a web browser:
+https://cast.chesapeakebay.net/","The CAST documentation contains many details on the computation and rationalization of inputs however, it does not provide the entirety of the numerical formulation of CAST in equation form, Such a description provided as one or a set of equations detailing the load function, how the inputs and watershed processes are modeled to estimate load delivered to the Ba is indispensable for formulating an efficient optimization model, Nevertheless, the structure of calculations in CAST presents several challenges for creating an integrated, allencompassing optimization system, The decision variables are also nonseparable, the decision space is high dimensional, Although good solutions were consistently found to instances of this nonlinear model, IPOPT does not guarantee global optimality and so additional computational advantage may be gained through further study of the models mathematical characteristics and exploration of effective approximations","CAST is the time-average watershed model of the Chesapeake Bay Watershed model, so no new!"
