Model,Water Body Type,Watershed Size,Watershed Type,Simulation Type,Parameters,Model Time Step ,Time Step,Computation requirements,Model Complexity,Simulation Objectives,Data Requirements,Model Availability,Model Limitations,Notes
L-THIA,Watershed,,,Continuous model,"Q, TP, TN",Annual,Annual,"Simple model (Yuan et al., 2020). No need for a high-end computer.",Simple,Screening Simulation,"LULC, Soil, Precipitation",Open source,"assumes that future climate conditions and land use changes will follow historical patterns, LTHIALID does not account for the potential impact of extreme storms, Annual Outputs, Urban and suburban land uses only, event mean concentration (EMC) is the critical parameter to simulate NPS loads",
Distributed Hydrology Soil and Vegetation Model (DHSVM-N),Watershed,,,Continuous model,"Q, TN",Daily,Daily,Computational expensive,Complex,Holistic Simulation,"DEM, LULC, Soil, Precipitation, Temperature",Open source,"limitations in capturing preferential flow path in soil layers that contribute to subsurface streamflow (Melo et al., 2021). does not represent urban land use. Simulates Nitrogen Only","DHSVM is a fully distributed process?based hydrological model, but it does not include processes related to environmental biogeochemical components such as those related to NPS pollutants. Parameters of
DHSVM?N include those used in the original DHSVM for the hydrologic modeling processes and those in SWAT
for the biogeochemical modeling processes. The integration of SWAT's biogeochemical processes into DHSVM involves extensive and substantial changes to the original DHSVM model."
Model to Assess River Inputs of Nutrients to Seas (MARINA) model,Watershed,,,Continuous model,"Q, TP, TN",Annual,Annual,Computational expensive,Simple,Nutrient load assessment,"water discharge, nutrient inputs from different sources, delineated subbasins",Not open source,"specifically for China, Does not simulate hydrology",
geomorphology-based nonpoint source pollution (GBNP),Watershed,,,Continuous model,"Q, TP, TN, TSS",Daily,Daily,Computational expensive,Medium,"Holistic Simulation, NPS nutrient loads evaluation","DEM, LULC, Soil, Precipitation, Temperature",Not open source,"does not simulate the strong biogeochemistry interaction between the atmosphere and the land surface , does not simulate fertilization of farmland, returning of manure, and air pollution around the city, uncertainty because it did not simulate the strong biogeochemistry interaction between the atmosphere and the land surface.",
Info Works (ICM),Watershed,,,Event-based model,"Q, TP, TN, TSS",Minutes,Sub-daily,Computational expensive,Complex,urban stormwater management,"DEM, LULC, hydraulic data, Precipitation, Temperature",Not open source,"Simulation results may differ in InfoWorks ICM due to different processing technologies, which may impact the numerically sensitive models, The water quality component in InfoWorks ICM is simplified, Only urban watersheds, small scale watersheds",
MIKE 21 FM,Water body,,,,,,,Computational expensive,,,,Not open source,"Its numerical scheme cannot handle a high gradient with the same flexibility as does Mike 21, When cells switch from dry to wet or vice versa, numerical oscillations are generated, so instabilities might occur, especially with low threshold values, The design and configuration of the mesh takes longer than setting up a MIKE 21 HD Classic model grid, The solution takes longer to solve than a similar MIKE 21 HD Classic model if you don't have access to a high powered, multicore CPU or a high-performance GPU, The numerical solution, while quite stable, is not as robust as the MIKE 21 HD Classic model",
GPUOM-WQ (graphics processing unit (GPU)-based three-dimensional coupled hydrodynamic and water quality numerical model),Water body,,,,,,,Computational expensive,,,,Not open source,,
WEP-N (Water and Energy transfer Processes and  Nitrogen cycle Processes Model in Cold regions),Watershed,,,Continuous model,"Q, TN",Daily,Daily,Computational expensive,Complex,Evaluate nitrogen loads in cold regions,"DEM, LULC, Soil, Precipitation, Temperature",Not open source,"The WEP-N model is based on mechanisms and, hence, requires relatively more input parameters, Limited to cold regions.",
MIKE SHE,Watershed,,,Continuous model,"Q, TP, TN, TSS",Daily,Daily,Computational expensive,Complex,"Watershed management, flood and drought management, evaluate water quality improvement","DEM, LULC, Soil, Precipitation, evapotranspiration",Not open source,"Huge amount of input variables and parameters necessary to run the model, The model is an extreme simplification of reality where equations cannot guarantee description of the actual complex three-dimensional spatially heterogeneous and time varying system, High degree of uncertainty in estimating the grid square values, The model remains a lumped model at a more sophisticated level, Predictive uncertainty, A relatively simple hydraulic model was used to calculate water levels and flows in open channels using a diffusion-wave approximation of the Saint-Venant equations",
MIKE11,Water body ,,,,,,,User-friendly,,,,Not open source,"It cannot model supercritical flow, for which both, discharge and water level, are controlled by the upstream boundary, It as constraints in representing two dimensional conditions, The model assumes channel slope is equal to zero, no direct modelling of two-and three-dimensional flow effects, Mike-11 is considered as a complex model and the accuracy of the outputs depends upon “good quality” flow, a comprehensive discretization of the watershed as well as water quality time series, The model requires a large amounts of data for model operation and calibration, It does not incorporate wind effects and urban drainage, It does not consider secondary currents and neglects bank erosion processes, It is seldom used to simulate chemical concentrations at a catchment scale",
MIKE HYDRO River,Water body,,,,,,,Low computation,,,,Not open source,"It is not typically used in flood modelling and mapping unless it is dynamically coupled with a 2D model, If the topography data is provided in small tiles, these tiles need to be combined to form a single topography data set in order to be used, MIKE HYDRO River does not have a steady-state solver so it always runs a fully hydrodynamic simulation, 1D hydraulic model, The dynamic model employed in MIKE HYDRO solves the Saint Venant equations","MIKE HYDRO River is the successor to the MIKE 11 (DHI, 2018)."
QUAL2K/ QUAL2Kw,Water body,,,,,,,Low computation,,,,Open source,"QUAL2K is limited in simulating streams and rivers quality in a one-dimensional steady state condition, Performing simulations in a non-permanent way and the impossibility of to change the internal structure of the model, insert equations that better represent the reality, Zooplankton and bacteria compartment are not considered, It can simulate the main stem of the river system but not its branches, The model was found to be highly sensitive to oxidation rate, depth coefficient and moderate to point sources flow, total nitrogen, CBOD, and nitrification rate",
Terrestrial Hydrology Model with Biogeochemistry (THMB),River,,,Continuous model,"Q, TN",Hourly,Sub-daily,Computational expensive,Complex,,,"Open source
(https://sage.nelson.wisc.edu/data-and-models/model-code/)",,"The THMB is a macro-scale water routing model that simulates transport and water storage
in the terrestrial hydrological system, including rivers, wetlands, lakes and
reservoirs. formerly known as HYDRA"
DYRESM–CAEDYM,Water body,,,,,,,Computational expensive,,,,Not open source,"The model only included cyanophytes and diatoms, Horizontal heterogeneity, It is  difficult to capture spatial heterogeneity of water quality, phytoplankton, and zooplankton in lakes as a one-dimensional model",
"Nutrient delivery ratio (NDR) model and Sediment Delivery Ratio (SDR), Water Yield (WY), Seasonal Water Yield Model (SWYM), InVEST",Watershed,,,Continuous model,"Q, TN",Annual,Annual,Computational expensive,Simple,Evaluate future scenarios on nitrogen,"DEM, LULC, Precipitation, Temperature","Open source
(https://naturalcapitalproject.stanford.edu/software/invest)","InVEST SDR computes soil loss only from sheet and rill erosion and thus, it did not consider other forms of erosion such as gully, stream bank and tunnel erosions, InVEST SDR demonstrated high potential for application in scenario studies and for prediction of suspended sediment export in large  catchments, but not total sediment load including bed load, There are errors associated with SWYM predictions, which include structural errors derived from the assumptions upon which the model works (e.g., flow routing and curve number methods), the suitability of selected parameters, and errors in the input data (climatic forcing variables), The processes of glaciers and permafrost are not considered by the InVEST model, The input data of the model are natural data and the socio-economic-related data are rarely considered",
PCLake,Water body,,,,,,,Computational expensive (intermediate level of complexity),,,,Open source (https://github.com/pcmodel/PCModel),"Its applicability in subtropical regions remains to be explored, PCLake computes a zero-dimensional system with homogeneous concentrations vertically and horizontally and can thus not account for possible near-surface accumulations, PCLake seemed to produce the all or nothing response in water quality variables, Ice-cover formation is not included in PCLake, Given the complex nature of PCLake, the model ischaracterized strongly by the nonuniqueness issue","Janse et al., 2014 developed a metamodel for PCLake.

Janssen et al., 2019 developed PCLake+ model."
PDP,Watershed,,,Continuous model,"Q, TP",Daily,Daily,,Simple,Estimate P exchange between Polder systems and surrounding rivers,"LULC, Precipitation, Temperature",Open Source,"model uncertainties, process simplification, Inadequate parameter optimization, simulates lowland watersheds ",
NDP,Watershed,,,Continuous model,"Q, TN",Daily,Daily,,Simple,Estimate N exchange between Polder systems and surrounding rivers,"LULC, Precipitation, Temperature",Open Source,"model uncertainties, simulates lowland watersheds",
Watershed Analysis Risk Management Framework (WARMF),Watershed,,,Continuous model,"Q, TP, TN, TSS",Daily,Daily,,Complex,"Holistic Simulation, TMDL development, Watershed management","DEM, LULC, Soil, Precipitation, Temperature",Not open source,"WARMF does not account for a tile drainage system, deep groundwater aquifers, and groundwater quality",
INCA-C,Watershed,,,Continuous model,"Q, Carbon",Daily,Daily,,Medium,"Holistic Simulation, evaluate pollutant sources","LULC, Precipitation, Temperature",Not open source,"structural parameter and data uncertainty, semi-distributed model",https://incamodels.org/
MIKE ECO-Lab,Water body,,,,,,,,,,,,,
EcoHydrological Assessment Tools (EcoHAT),Water body,,,,,,,,,,,,,
MIKE11 HD,Water body,,,,,,,,,,,,,
MIKE 11 AD,Water body,,,,,,,,,,,,,
INCA-P,Watershed,,,Continuous model,"Q, TP",Daily,Daily,,Medium,"Holistic Simulation, evaluate P sources","LULC, Precipitation, Temperature",Not open source,"structural parameter and data uncertainty, semi-distributed model, does not simulate the small-scale transport of P across the land surface, the representation of the P soil processes does not account for soil type, microbe species, and the in-stream model does not include any mechanism to simulate macrophyte species competition, or cutting.",https://incamodels.org/
INCA-N,Watershed,,,Continuous model,"Q, TN",Daily,Daily,,Medium,"Holistic Simulation, evaluate N sources","LULC, Precipitation, Temperature",Not open source,"structural parameter and data uncertainty, semi-distributed model, the ability to simulate and predict a catchment’s behaviour exactly in response to environmental perturbations remains unlikely",https://incamodels.org/
Finite-Volume Community Ocean Model (FVCOM),Water body,,,,,,,,,,,,,
Nutrient-Phytoplankton-Zooplankton-Detritus (NPZD),Water body,,,,,,,,,,,,,
HSPF-SWMM,Watershed,,,,,,,,,,,,,
SEAWAT-MODFLOW,,,,,,,,,,,,,,
SUSTAIN,Watershed,"Small, Medium",Urban,Continuous model,"Q, TP, TN, TSS",Hourly,Sub-daily,,Complex,"Holistic Simulation, TMDL development, evaluate green infrastructure implementation, BMP cost estimation ","DEM, LULC, Soil, Precipitation, Temperature, Wind speed",Open source,"manual calibration, poor groundwater simulation, does not simulate large watersheds",
